{
  "$schema": "../../schemas/repository.schema.json",
  "schemaVersion": "1.0.0",
  "repositoryId": "grafana",
  "title": "grafana/grafana",
  "description": "Highly active observability platform combining a large Go backend with substantial TypeScript and React frontend surfaces.",
  "defaultBranch": "main",
  "source": {
    "kind": "git",
    "createdAt": "2026-03-24",
    "url": "https://github.com/grafana/grafana.git",
    "pinnedCommit": "e01b4ee380c7ca673f4e35667d0e9491d9cd3fa1",
    "license": "AGPL-3.0",
    "extractionJustification": "PoC extraction limited to pinned startup and configuration anchor files so the benchmark remains runnable in-repo while full-repository task curation is still in progress."
  },
  "languages": [
    "go",
    "typescript"
  ],
  "frameworks": [
    "grafana",
    "react",
    "protobuf"
  ],
  "stats": {
    "approxFileCount": 22000,
    "approxTokenCount": 14000000,
    "entrypointFiles": [
      "./README.md",
      "./go.mod",
      "./package.json",
      "./pkg/cmd/grafana/main.go"
    ]
  },
  "environment": {
    "profileId": "go-typescript-monorepo"
  },
  "tasks": [
    {
      "taskId": "grafana-startup-map",
      "taskDirectory": "./tasks/grafana-startup-map",
      "tags": [
        "real",
        "runnable",
        "analysis"
      ]
    }
  ],
  "fixtureRoot": "../../snapshots/grafana"
}
