{
  "$schema": "../../schemas/repository.schema.json",
  "schemaVersion": "1.0.0",
  "repositoryId": "rust",
  "title": "rust-lang/rust",
  "description": "Compiler-scale Rust repository with compiler internals, standard library, cargo integration, tooling, and build orchestration.",
  "defaultBranch": "main",
  "source": {
    "kind": "git",
    "createdAt": "2026-03-24",
    "url": "https://github.com/rust-lang/rust.git",
    "pinnedCommit": "0312931d8c0ba1a28268a12c06202b68cbc65f76",
    "license": "Apache-2.0 OR MIT",
    "extractionJustification": "PoC extraction limited to pinned startup and configuration anchor files so the benchmark remains runnable in-repo while full-repository task curation is still in progress."
  },
  "languages": [
    "rust",
    "python"
  ],
  "frameworks": [
    "rustc",
    "cargo"
  ],
  "stats": {
    "approxFileCount": 24000,
    "approxTokenCount": 18000000,
    "entrypointFiles": [
      "./README.md",
      "./x.py",
      "./compiler/rustc_driver/src/lib.rs"
    ]
  },
  "environment": {
    "profileId": "rust-compiler"
  },
  "tasks": [
    {
      "taskId": "rustc-startup-map",
      "taskDirectory": "./tasks/rustc-startup-map",
      "tags": [
        "real",
        "runnable",
        "analysis"
      ]
    }
  ],
  "fixtureRoot": "../../snapshots/rust"
}
